{"artifact_version":"0.2.0","builds":[{"backend":"webgl2","catalog_hash":"sha256:73432b2d7f6b1719424507175ea67057f93c5fdc784375681fa9acda2ba31759","entry":"viewer.mjs","input_kinds":["render-package"],"level":"C","manifest":{"bytes":1579,"sha256":"88649821b4a095e51903733b92f67484c983b51e6242106a81a4b558f4abaaf6"},"path":"embed/web-basic-webgl2","product":"embed","profile":"web-basic-webgl2","protocol_version":1,"render_package_version":{"major":1,"minor":3},"requires":{"secure_context":true,"wasm":true,"webgl2":{"min_samples":4}},"transfer":{"catalog_features":["Events","basic_models","controls","diagnostics.graphics"],"files":{"client.mjs":{"brotli_11":1178,"gzip_9":1394,"raw":4419,"stripped":4419},"generated/web-basic-webgl2/catalog.json":{"brotli_11":15252,"gzip_9":20358,"raw":189908,"stripped":189908},"generated/web-basic-webgl2/catalog.sha256":{"brotli_11":63,"gzip_9":80,"raw":72,"stripped":72},"generated/web-basic-webgl2/client.d.ts":{"brotli_11":7989,"gzip_9":9062,"raw":49877,"stripped":49877},"generated/web-basic-webgl2/custom-elements.json":{"brotli_11":963,"gzip_9":1207,"raw":6033,"stripped":6033},"generated/web-basic-webgl2/element.d.ts":{"brotli_11":798,"gzip_9":930,"raw":3181,"stripped":3181},"generated/web-basic-webgl2/element.json":{"brotli_11":1133,"gzip_9":1368,"raw":3955,"stripped":3955},"renderer-webgl2.wasm":{"brotli_11":9060837,"gzip_9":14313455,"raw":41489584,"stripped":41489424},"renderer_webgl2.js":{"brotli_11":11435,"gzip_9":13691,"raw":89626,"stripped":89626},"viewer.mjs":{"brotli_11":13163,"gzip_9":15284,"raw":64017,"stripped":64017}},"linked_feature_graph":null,"provisional_budgets_enforced":false}}],"index_version":1,"loader":"loader/choose.mjs"}